{
  "schema_version": 2,
  "data_version": "0.7.0-preview",
  "status": "parameterization_in_progress",
  "species": [
    {
      "id": "fittonia_albivenis",
      "scientific_name": "Fittonia albivenis",
      "type": "plant",
      "ecological_roles": [
        "producer",
        "litter_source"
      ],
      "life_stages": [
        "ramet_young",
        "ramet_adult",
        "senescent"
      ],
      "sources": [
        "docs/BIOLOGY_SOURCES.md#fittonia-albivenis"
      ],
      "runtime_parameter_status": "PARTIAL",
      "traits": [
        "clonal",
        "ramet_clonal_lifecycle",
        "producer",
        "litter_source",
        "moisture_sensitive",
        "temperature_response"
      ],
      "profile_path": "data/species-profiles/fittonia_albivenis.json"
    },
    {
      "id": "peperomia_caperata",
      "scientific_name": "Peperomia caperata",
      "type": "plant",
      "ecological_roles": [
        "producer",
        "litter_source"
      ],
      "life_stages": [
        "ramet_young",
        "ramet_adult",
        "senescent"
      ],
      "sources": [
        "docs/BIOLOGY_SOURCES.md#peperomia-caperata"
      ],
      "runtime_parameter_status": "PARTIAL",
      "traits": [
        "clonal",
        "ramet_clonal_lifecycle",
        "producer",
        "litter_source",
        "moisture_sensitive",
        "temperature_response"
      ],
      "profile_path": "data/species-profiles/peperomia_caperata.json"
    },
    {
      "id": "pilea_depressa",
      "scientific_name": "Pilea depressa",
      "type": "plant",
      "ecological_roles": [
        "producer",
        "litter_source",
        "groundcover"
      ],
      "life_stages": [
        "ramet_young",
        "ramet_adult",
        "senescent"
      ],
      "sources": [
        "docs/BIOLOGY_SOURCES.md#pilea-depressa"
      ],
      "runtime_parameter_status": "PARTIAL",
      "traits": [
        "clonal",
        "ramet_clonal_lifecycle",
        "producer",
        "litter_source",
        "groundcover",
        "moisture_sensitive",
        "temperature_response"
      ],
      "profile_path": "data/species-profiles/pilea_depressa.json"
    },
    {
      "id": "pilea_microphylla",
      "scientific_name": "Pilea microphylla",
      "type": "plant",
      "ecological_roles": [
        "producer",
        "litter_source",
        "groundcover"
      ],
      "life_stages": [
        "propagule",
        "ramet_young",
        "ramet_adult",
        "senescent"
      ],
      "sources": [
        "docs/BIOLOGY_SOURCES.md#pilea-microphylla"
      ],
      "runtime_parameter_status": "PARTIAL",
      "traits": [
        "clonal",
        "ramet_clonal_lifecycle",
        "producer",
        "litter_source",
        "groundcover",
        "moisture_sensitive",
        "temperature_response"
      ],
      "profile_path": "data/species-profiles/pilea_microphylla.json"
    },
    {
      "id": "folsomia_candida",
      "scientific_name": "Folsomia candida",
      "type": "animal",
      "ecological_roles": [
        "fungivore",
        "microbivore",
        "prey"
      ],
      "life_stages": [
        "egg",
        "juvenile",
        "adult"
      ],
      "sources": [
        "docs/BIOLOGY_SOURCES.md#folsomia-candida"
      ],
      "runtime_parameter_status": "PARTIAL",
      "traits": [
        "parthenogenetic",
        "egg_juvenile_adult",
        "fungivore",
        "microbivore",
        "substrate_walker",
        "moisture_sensitive",
        "temperature_response"
      ],
      "profile_path": "data/species-profiles/folsomia_candida.json"
    },
    {
      "id": "trichorhina_tomentosa",
      "scientific_name": "Trichorhina tomentosa",
      "type": "animal",
      "ecological_roles": [
        "detritivore",
        "fungivore"
      ],
      "life_stages": [
        "manca",
        "juvenile",
        "adult"
      ],
      "sources": [
        "docs/BIOLOGY_SOURCES.md#trichorhina-tomentosa"
      ],
      "runtime_parameter_status": "PARTIAL",
      "traits": [
        "parthenogenetic",
        "manca_juvenile_adult",
        "detritivore",
        "fungivore",
        "substrate_walker",
        "under_litter",
        "moisture_sensitive",
        "temperature_response"
      ],
      "profile_path": "data/species-profiles/trichorhina_tomentosa.json"
    },
    {
      "id": "bradysia_impatiens",
      "scientific_name": "Bradysia impatiens",
      "type": "animal",
      "ecological_roles": [
        "fungivore_larva",
        "root_feeder_larva",
        "prey"
      ],
      "life_stages": [
        "egg",
        "larva",
        "pupa",
        "adult"
      ],
      "sources": [
        "docs/BIOLOGY_SOURCES.md#bradysia-impatiens"
      ],
      "runtime_parameter_status": "PARTIAL",
      "traits": [
        "sexual",
        "egg_larva_pupa_adult",
        "fungivore",
        "root_feeder",
        "substrate_walker",
        "flyer",
        "moisture_sensitive",
        "temperature_response"
      ],
      "profile_path": "data/species-profiles/bradysia_impatiens.json"
    },
    {
      "id": "dalotia_coriaria",
      "scientific_name": "Dalotia coriaria",
      "type": "animal",
      "ecological_roles": [
        "predator"
      ],
      "life_stages": [
        "egg",
        "larva",
        "pupa",
        "adult"
      ],
      "sources": [
        "docs/BIOLOGY_SOURCES.md#dalotia-coriaria"
      ],
      "runtime_parameter_status": "PARTIAL",
      "traits": [
        "sexual",
        "egg_larva_pupa_adult",
        "predator",
        "substrate_walker",
        "flyer",
        "moisture_sensitive",
        "temperature_response"
      ],
      "profile_path": "data/species-profiles/dalotia_coriaria.json"
    },
    {
      "id": "linnemannia_elongata",
      "scientific_name": "Linnemannia elongata",
      "type": "fungus",
      "ecological_roles": [
        "saprotroph",
        "fungal_food"
      ],
      "sources": [
        "docs/BIOLOGY_SOURCES.md#linnemannia-elongata"
      ],
      "runtime_parameter_status": "PARTIAL",
      "life_stages": [
        "biomass_field"
      ],
      "traits": [
        "biomass_field",
        "saprotroph",
        "temperature_response",
        "moisture_sensitive"
      ],
      "profile_path": "data/species-profiles/linnemannia_elongata.json"
    },
    {
      "id": "bacillus_subtilis",
      "scientific_name": "Bacillus subtilis",
      "type": "bacterium",
      "ecological_roles": [
        "decomposer"
      ],
      "sources": [
        "docs/BIOLOGY_SOURCES.md#bacillus-subtilis"
      ],
      "runtime_parameter_status": "PARTIAL",
      "life_stages": [
        "biomass_field"
      ],
      "traits": [
        "biomass_field",
        "saprotroph",
        "temperature_response",
        "moisture_sensitive"
      ],
      "profile_path": "data/species-profiles/bacillus_subtilis.json"
    }
  ]
}
